{
  "schema_version": "1.0",
  "event_id": "9ec6070a-9373-4ff9-ac4c-37610b8aa684",
  "operation_id": "b7e16831-2d62-45da-92e6-324a2ad61cb6",
  "order_id": "942c0e14-d362-42a9-a16c-a35d0e78eb34",
  "occurred_at": "2026-09-17T09:00:00Z",
  "items": [
    {
      "order_line_id": "1b4f1d4a-0e5b-421d-ab75-376db9a4fcab",
	  "product_id": "b4600000-0000-4000-8001-000000000001",
      "quantity": 2
    }
  ]
}
